{
  "kind": "checklist",
  "name": "employee-onboarding",
  "version": "1.0.0",
  "title": "Employee Onboarding Checklist",
  "items": [
    { "id": "signed-contract", "title": "Signed Employment Contract", "status": { "kind": "boolean" } },
    { "id": "received-equipment", "title": "Received Equipment", "status": { "kind": "boolean" } },
    { "id": "completed-training", "title": "Completed Training", "status": { "kind": "boolean" } }
  ]
}
